{"area":"MA","unit":"MW","from":"2024-01-01","to":"2026-10-16","source":"EIA-930 hourly demand, ISO-NE subregions 4006 + 4007 + 4008 (all customer classes)","zones":["NEMA","SEMA","WCMA"],"mw":[[5299,5139,5012,4952,4989,5124,5330,5468,5557,5598,5672,5774,5693,5663,5855,6204,6752,7167,7094,6929,6715,6408,5996,5651],[5421,5287,5254,5304,5493,5926,6612,7018,6970,6698,6454,6286,6229,6268,6415,6732,7228,7609,7547,7370,7124,6732,6255,5847],[5575,5415,5350,5368,5526,5939,6575,6949,6946,6713,6502,6320,6320,6480,6644,6828,7229,7485,7370,7170,6896,6506,6002,5562],[5293,5121,5045,5041,5182,5586,6215,6649,6744,6700,6531,6424,6297,6306,6422,6679,7117,7491,7483,7379,7193,6865,6450,6089],[5834,5711,5665,5693,5863,6280,6941,7354,7319,7067,6807,6605,6545,6653,6802,7065,7506,7753,7588,7431,7190,6865,6445,6044],[5755,5570,5459,5422,5463,5611,5855,6122,6319,6341,6354,6519,6643,6658,6561,6731,7069,7294,7197,6986,6788,6515,6146,5805],[5560,5367,5260,5221,5228,5340,5536,5783,6087,6426,6694,6959,7162,7237,7280,7288,7522,7797,7700,7479,7203,6828,6369,5960],[5681,5521,5464,5491,5653,6020,6634,7084,7312,7328,7284,7210,7079,7028,6973,7074,7435,7781,7729,7564,7322,6962,6485,6088],[5834,5697,5657,5708,5871,6281,6952,7372,7499,7517,7453,7381,7330,7277,7244,7345,7604,7790,7670,7469,7160,6729,6208,5770],[5433,5242,5116,5066,5134,5486,6043,6436,6446,6386,6364,6355,6309,6293,6226,6493,6890,7221,7139,6955,6684,6315,5857,5444],[5189,5027,4964,4971,5130,5537,6193,6629,6731,6661,6512,6337,6391,6591,6634,6699,7023,7324,7227,7043,6799,6456,5980,5563],[5295,5151,5092,5097,5242,5646,6304,6687,6607,6319,6048,5862,5798,5866,5980,6272,6694,7027,6933,6741,6524,6236,5845,5485],[5217,5040,4953,4922,4961,5106,5350,5605,5880,6118,6252,6234,6003,5714,5713,5921,6230,6511,6453,6313,6157,5966,5694,5403],[5188,5050,4971,4955,5018,5167,5416,5639,5718,5648,5626,5778,6016,6228,6403,6601,6937,7240,7242,7104,6938,6692,6350,6036],[5786,5650,5594,5633,5781,6098,6522,6886,6949,6815,6672,6552,6498,6611,6765,7136,7590,7882,7768,7573,7316,6923,6425,5993],[5734,5589,5537,5562,5728,6120,6750,7203,7433,7594,7705,7788,7800,7738,7620,7627,7840,8044,7950,7765,7500,7093,6637,6248],[6037,5902,5868,5906,6083,6523,7192,7645,7714,7652,7541,7490,7409,7354,7357,7529,7875,8231,8198,8068,7861,7508,7050,6638],[6396,6248,6195,6208,6369,6770,7449,7860,7931,7913,7895,7811,7713,7630,7591,7688,7932,8173,8068,7920,7668,7260,6788,6362],[6091,5944,5876,5892,6047,6427,7048,7491,7656,7705,7739,7704,7600,7599,7601,7630,7831,8031,7923,7785,7567,7302,6941,6591],[6380,6224,6169,6179,6250,6448,6738,7050,7370,7552,7610,7583,7509,7476,7529,7688,7973,8197,8155,8007,7840,7594,7254,6912],[6656,6473,6383,6362,6391,6514,6742,6979,7232,7285,7276,7261,7208,7142,7160,7343,7723,8124,8117,7974,7766,7413,6968,6579],[6347,6210,6175,6214,6379,6780,7475,7888,7868,7694,7461,7235,7060,6994,7066,7357,7675,8020,7891,7656,7368,6949,6440,6017],[5722,5524,5443,5441,5605,6005,6649,7040,7100,7092,7111,7130,7071,7064,7055,7136,7379,7696,7609,7401,7117,6745,6273,5864],[5628,5464,5395,5399,5553,5941,6557,6992,7192,7307,7355,7371,7352,7313,7273,7281,7477,7677,7537,7318,7047,6629,6149,5719],[5430,5217,5098,5061,5172,5530,6124,6531,6653,6653,6568,6404,6263,6280,6290,6430,6763,7106,7057,6884,6638,6305,5852,5462],[5199,5027,4952,4959,5118,5509,6143,6612,6834,6941,6982,6973,6911,6889,6847,6856,7022,7195,7054,6822,6597,6304,5935,5582],[5316,5136,5040,5002,5050,5210,5488,5765,6044,6206,6317,6370,6341,6313,6270,6329,6595,6871,6797,6613,6431,6176,5847,5557],[5285,5109,5006,4960,4979,5090,5296,5551,5879,6201,6502,6703,6764,6798,6828,6894,7097,7305,7257,7048,6823,6468,6063,5677],[5437,5278,5218,5234,5420,5817,6421,6868,7132,7205,7239,7279,7317,7303,7243,7303,7543,7843,7733,7493,7199,6804,6328,5893],[5630,5461,5394,5398,5559,5986,6656,7109,7299,7388,7421,7436,7389,7341,7360,7455,7697,8021,7945,7744,7482,7079,6586,6145],[5867,5689,5608,5611,5764,6160,6811,7245,7394,7418,7441,7399,7365,7331,7268,7321,7512,7784,7712,7481,7198,6808,6321,5874],[5610,5424,5343,5333,5481,5879,6515,6924,7074,7068,6989,6901,6830,6879,6907,6990,7184,7433,7331,7147,6866,6500,6038,5637],[5349,5181,5097,5098,5238,5606,6227,6668,6844,6935,6914,6838,6785,6737,6694,6730,6940,7164,7061,6859,6671,6398,6037,5697],[5457,5287,5198,5192,5265,5436,5753,6021,6188,6195,6104,5987,5816,5745,5828,6095,6546,6970,6994,6837,6686,6463,6163,5861],[5638,5502,5428,5411,5470,5614,5848,6030,5989,5832,5677,5578,5542,5541,5689,6032,6547,7072,7165,7037,6809,6498,6101,5744],[5520,5398,5357,5408,5600,6045,6731,7077,6866,6517,6248,6082,5999,6012,6133,6454,6951,7421,7424,7282,7038,6671,6202,5813],[5582,5436,5386,5422,5596,6015,6713,7099,7064,6839,6612,6432,6355,6357,6401,6625,7030,7437,7456,7325,7088,6737,6266,5875],[5609,5472,5414,5445,5606,6015,6688,7032,6860,6545,6324,6127,5990,5969,6140,6470,6855,7307,7317,7163,6948,6616,6171,5788],[5556,5410,5361,5396,5576,6014,6678,6981,6772,6483,6162,5822,5662,5668,5787,6113,6588,7085,7151,7011,6814,6489,6062,5683],[5440,5293,5239,5258,5409,5800,6411,6744,6911,6964,6880,6590,6221,5859,5855,6078,6472,6876,6861,6665,6445,6174,5812,5481],[5209,5026,4931,4907,4963,5133,5407,5602,5601,5514,5498,5431,5441,5365,5325,5451,5785,6206,6239,6061,5871,5635,5348,5047],[4819,4665,4579,4555,4600,4743,4967,5149,5294,5406,5483,5561,5690,5753,5716,5840,6195,6713,6653,6333,6120,5918,5629,5389],[5129,4964,4918,4974,5176,5613,6275,6599,6444,6028,5828,5592,5523,5612,5840,6108,6499,6959,7028,6854,6595,6276,5868,5500],[5258,5107,5028,5031,5148,5441,5888,6280,6649,6949,7176,7346,7432,7371,7260,7177,7243,7492,7455,7247,6984,6623,6174,5800],[5566,5427,5380,5395,5563,5998,6664,7049,7006,6869,6710,6564,6463,6449,6497,6724,7121,7560,7642,7508,7325,7019,6579,6195],[5943,5802,5733,5743,5908,6310,6934,7224,7046,6772,6540,6347,6279,6393,6350,6595,7006,7374,7380,7253,7037,6751,6310,5889],[5613,5433,5343,5346,5503,5900,6504,6838,6863,6764,6501,6312,6161,6152,6229,6425,6840,7262,7278,7107,6907,6623,6258,5889],[5623,5445,5345,5308,5370,5537,5815,6094,6392,6596,6544,6327,6243,6263,6311,6413,6633,6996,7103,6973,6824,6621,6315,6026],[5821,5670,5605,5595,5639,5788,6009,6161,6238,6250,6054,5822,5704,5715,5885,6217,6614,7032,7100,6929,6715,6434,6103,5788],[5577,5439,5373,5388,5524,5821,6204,6353,6234,6065,5907,5789,5729,5749,5876,6196,6692,7260,7374,7224,7018,6709,6309,5977],[5777,5668,5632,5687,5878,6281,6844,7091,6884,6536,6274,6083,5985,5967,6063,6324,6750,7265,7338,7292,7083,6772,6367,5999],[5785,5673,5626,5671,5836,6251,6778,7001,6816,6555,6284,6002,5817,5812,5942,6227,6699,7194,7330,7186,6968,6651,6254,5900],[5666,5545,5509,5535,5706,6102,6640,6854,6684,6418,6130,5944,5839,5843,5929,6192,6662,7063,7114,6938,6703,6392,5975,5601],[5341,5165,5078,5066,5174,5503,5978,6352,6576,6695,6757,6753,6580,6430,6443,6471,6632,6880,6830,6617,6404,6102,5743,5415],[5175,5012,4917,4892,4954,5137,5387,5602,5858,5994,5978,5705,5541,5617,5547,5730,6172,6712,6948,6855,6755,6565,6297,6034],[5837,5713,5666,5663,5718,5875,6080,6091,5909,5708,5539,5426,5378,5379,5515,5841,6375,6957,7192,7079,6865,6545,6131,5769],[5527,5395,5325,5327,5473,5859,6477,6749,6657,6494,6041,5705,5514,5439,5538,5801,6232,6750,6907,6734,6501,6147,5729,5360],[5139,5021,4985,5021,5195,5637,6258,6492,6238,5877,5529,5345,5248,5282,5440,5743,6131,6570,6696,6533,6272,5900,5438,5042],[4781,4625,4538,4516,4647,5009,5640,6064,6252,6357,6394,6426,6337,6323,6280,6271,6431,6719,6707,6499,6238,5874,5454,5130],[4989,4917,4939,5027,5255,5735,6405,6591,6390,6226,6215,6239,6183,6175,6224,6445,6894,7409,7593,7495,7314,6972,6509,6121],[5872,5709,5645,5658,5821,6226,6800,6937,6697,6382,6079,5844,5685,5647,5730,5969,6387,6833,6949,6819,6671,6394,6033,5686],[5414,5238,5135,5082,5110,5260,5487,5692,5850,5885,6003,6119,6164,6164,6125,6174,6314,6495,6487,6303,6089,5833,5519,5200],[4939,4745,4632,4569,4581,4690,4869,5065,5267,5365,5230,5121,5124,5147,5140,5297,5616,6062,6304,6169,5945,5621,5230,4869],[4638,4489,4437,4468,4620,5021,5612,5882,5844,5762,5769,5796,5833,5862,5854,5993,6274,6634,6757,6596,6358,6001,5556,5169],[4925,4764,4701,4710,4865,5255,5857,6249,6402,6484,6519,6524,6530,6500,6516,6536,6656,6905,6906,6766,6511,6126,5653,5244],[4976,4817,4733,4735,4869,5255,5828,6155,6201,6086,5896,5895,5961,6036,6109,6233,6436,6690,6717,6538,6295,5943,5507,5140],[4912,4770,4701,4697,4854,5246,5848,6239,6401,6490,6488,6436,6368,6412,6417,6511,6691,6900,6938,6795,6589,6245,5817,5447],[5173,5029,4967,4992,5148,5549,6084,6146,5886,5607,5374,5221,5135,5151,5238,5499,5904,6343,6559,6452,6299,6068,5749,5438],[5228,5072,4987,4966,5018,5172,5383,5631,5929,6133,6185,6101,6103,6054,6053,6190,6369,6570,6626,6469,6284,6024,5696,5385],[5144,4979,4923,4867,4819,4871,4992,5121,5244,5278,5138,5050,5084,5145,5208,5305,5593,6017,6321,6431,6279,5992,5614,5251],[5018,4883,4841,4889,5080,5496,6158,6634,6620,6301,6094,5989,5883,5900,5857,5896,6111,6519,6784,6938,6785,6451,5988,5567],[5286,5120,5043,5048,5190,5571,6210,6568,6332,5902,5543,5277,5115,5018,5002,5153,5480,5955,6309,6490,6338,6027,5599,5223],[4973,4838,4791,4818,4990,5389,6058,6403,6197,5772,5418,5164,4990,4907,4944,5131,5476,5902,6212,6388,6238,5925,5503,5106],[4857,4692,4623,4641,4795,5195,5860,6232,6039,5717,5393,5065,4901,4839,4848,4998,5293,5719,6027,6212,6071,5776,5367,4994],[4723,4542,4467,4454,4577,4931,5530,5943,6115,6219,6148,6063,6082,6075,6097,6108,6224,6346,6380,6373,6195,5925,5568,5218],[4951,4765,4665,4627,4669,4825,5100,5313,5307,5126,4893,4726,4706,4701,4707,4737,4965,5317,5613,5783,5689,5496,5218,4923],[4691,4525,4429,4382,4400,4510,4719,4967,5243,5431,5327,5031,4869,4914,4923,5014,5215,5538,5808,6021,5929,5642,5265,4930],[4697,4573,4520,4534,4697,5090,5747,6161,6124,5745,5505,5446,5284,5117,5026,5147,5473,5934,6300,6522,6384,6064,5632,5250],[5011,4872,4822,4847,5009,5435,6112,6412,6198,5872,5591,5410,5393,5464,5462,5511,5843,6267,6516,6661,6529,6197,5720,5310],[5063,4910,4842,4853,4988,5365,5993,6386,6410,6153,5613,5645,5666,5571,5694,5993,6246,6457,6607,6647,6493,6209,5797,5447],[5248,5123,5089,5130,5315,5768,6466,6831,6657,